{
  "reading_id": "sha256:4a05510f3c1a6893eef2cd322dd63b453f9acf7b0a593ab56b0bb6bb8bbc9de0",
  "timestamp": "2026-10-06T00:00:00.000Z",
  "atmospheric_regime": "PRESSURE_DIFFERENTIAL",
  "candidate_regimes": [
    "PRESSURE_DIFFERENTIAL",
    "COLD_FRONT",
    "HIGH_PRESSURE"
  ],
  "signal_manifest": [
    {
      "signal_type": "available_time_margin",
      "signal_id": "sha256:3f7562a4eed4c6817971b16bd9e44ea877da07dfac3c82eb765c04fe3c298c44",
      "magnitude": 0.12,
      "direction": "FALLING",
      "rate_of_change": -0.015833333333333335,
      "observation_window": {
        "start": "2026-10-05T00:00:00.000Z",
        "end": "2026-10-06T00:00:00.000Z"
      },
      "comparison_window": {
        "start": "2026-10-04T00:00:00.000Z",
        "end": "2026-10-05T00:00:00.000Z"
      },
      "source_domain": "CALENDAR",
      "extractor_id": "calendar.edge.f0.1",
      "extractor_version": "0.1.0",
      "timestamp": "2026-10-06T00:00:00.000Z"
    },
    {
      "signal_type": "buffer_compression",
      "signal_id": "sha256:d26f31d861738486879f42c7425e049f99280e16efcab5d28040059139e61b7d",
      "magnitude": 1,
      "direction": "RISING",
      "rate_of_change": 0.041666666666666664,
      "observation_window": {
        "start": "2026-10-05T00:00:00.000Z",
        "end": "2026-10-06T00:00:00.000Z"
      },
      "comparison_window": {
        "start": "2026-10-04T00:00:00.000Z",
        "end": "2026-10-05T00:00:00.000Z"
      },
      "source_domain": "CALENDAR",
      "extractor_id": "calendar.edge.f0.1",
      "extractor_version": "0.1.0",
      "timestamp": "2026-10-06T00:00:00.000Z"
    },
    {
      "signal_type": "commit_velocity",
      "signal_id": "sha256:8e4481e002f4fe987d9fe316a0a09c7b322696c7fb1cf8ad25ef3f41a2f278fc",
      "magnitude": 1,
      "direction": "RISING",
      "rate_of_change": 0.03125,
      "observation_window": {
        "start": "2026-10-05T00:00:00.000Z",
        "end": "2026-10-06T00:00:00.000Z"
      },
      "comparison_window": {
        "start": "2026-10-04T00:00:00.000Z",
        "end": "2026-10-05T00:00:00.000Z"
      },
      "source_domain": "GIT",
      "extractor_id": "git.edge.f0.1",
      "extractor_version": "0.1.0",
      "timestamp": "2026-10-06T00:00:00.000Z"
    },
    {
      "signal_type": "meeting_density",
      "signal_id": "sha256:0aba54ea881e32142bcc85eb6a753d1df2ce9b415453d57c9b3666e825c236bd",
      "magnitude": 0.88,
      "direction": "RISING",
      "rate_of_change": 0.015833333333333335,
      "observation_window": {
        "start": "2026-10-05T00:00:00.000Z",
        "end": "2026-10-06T00:00:00.000Z"
      },
      "comparison_window": {
        "start": "2026-10-04T00:00:00.000Z",
        "end": "2026-10-05T00:00:00.000Z"
      },
      "source_domain": "CALENDAR",
      "extractor_id": "calendar.edge.f0.1",
      "extractor_version": "0.1.0",
      "timestamp": "2026-10-06T00:00:00.000Z"
    },
    {
      "signal_type": "open_pr_age",
      "signal_id": "sha256:edaf76d36e396a54bc7999e668d095782324afabebbc5926eccf758c53b31def",
      "magnitude": 0.5,
      "direction": "RISING",
      "rate_of_change": 0.014880952380952382,
      "observation_window": {
        "start": "2026-10-05T00:00:00.000Z",
        "end": "2026-10-06T00:00:00.000Z"
      },
      "comparison_window": {
        "start": "2026-10-04T00:00:00.000Z",
        "end": "2026-10-05T00:00:00.000Z"
      },
      "source_domain": "GIT",
      "extractor_id": "git.edge.f0.1",
      "extractor_version": "0.1.0",
      "timestamp": "2026-10-06T00:00:00.000Z"
    },
    {
      "signal_type": "review_latency",
      "signal_id": "sha256:37d4a59d83056e8dac9a6f32bf2747401e82cc0d74cbc39bf445bb5fd082fc59",
      "magnitude": 0.875,
      "direction": "RISING",
      "rate_of_change": 0.033854166666666664,
      "observation_window": {
        "start": "2026-10-05T00:00:00.000Z",
        "end": "2026-10-06T00:00:00.000Z"
      },
      "comparison_window": {
        "start": "2026-10-04T00:00:00.000Z",
        "end": "2026-10-05T00:00:00.000Z"
      },
      "source_domain": "GIT",
      "extractor_id": "git.edge.f0.1",
      "extractor_version": "0.1.0",
      "timestamp": "2026-10-06T00:00:00.000Z"
    }
  ],
  "visibility": "ILLUMINATED",
  "confidence": {
    "basis": "UNCALIBRATED_RULE_SUPPORT",
    "level": "SUPPORTED"
  },
  "current_conditions": [
    {
      "condition_code": "TIME_TIGHT",
      "signal_refs": [
        "sha256:3f7562a4eed4c6817971b16bd9e44ea877da07dfac3c82eb765c04fe3c298c44"
      ]
    },
    {
      "condition_code": "BUFFERS_COMPRESSED",
      "signal_refs": [
        "sha256:d26f31d861738486879f42c7425e049f99280e16efcab5d28040059139e61b7d"
      ]
    },
    {
      "condition_code": "PRODUCTION_RISING",
      "signal_refs": [
        "sha256:8e4481e002f4fe987d9fe316a0a09c7b322696c7fb1cf8ad25ef3f41a2f278fc"
      ]
    },
    {
      "condition_code": "MEETINGS_DENSE",
      "signal_refs": [
        "sha256:0aba54ea881e32142bcc85eb6a753d1df2ce9b415453d57c9b3666e825c236bd"
      ]
    },
    {
      "condition_code": "PRS_AGING",
      "signal_refs": [
        "sha256:edaf76d36e396a54bc7999e668d095782324afabebbc5926eccf758c53b31def"
      ]
    },
    {
      "condition_code": "REVIEW_WAITS_LONG",
      "signal_refs": [
        "sha256:37d4a59d83056e8dac9a6f32bf2747401e82cc0d74cbc39bf445bb5fd082fc59"
      ]
    }
  ],
  "primary_drivers": [
    {
      "condition_code": "PRODUCTION_RISING",
      "signal_refs": [
        "sha256:8e4481e002f4fe987d9fe316a0a09c7b322696c7fb1cf8ad25ef3f41a2f278fc"
      ]
    },
    {
      "condition_code": "REVIEW_WAITS_LONG",
      "signal_refs": [
        "sha256:37d4a59d83056e8dac9a6f32bf2747401e82cc0d74cbc39bf445bb5fd082fc59"
      ]
    },
    {
      "condition_code": "TIME_TIGHT",
      "signal_refs": [
        "sha256:3f7562a4eed4c6817971b16bd9e44ea877da07dfac3c82eb765c04fe3c298c44"
      ]
    }
  ],
  "forming_fronts": [
    {
      "condition_code": "POSSIBLE_REVIEW_BOTTLENECK",
      "signal_refs": [
        "sha256:8e4481e002f4fe987d9fe316a0a09c7b322696c7fb1cf8ad25ef3f41a2f278fc",
        "sha256:37d4a59d83056e8dac9a6f32bf2747401e82cc0d74cbc39bf445bb5fd082fc59",
        "sha256:3f7562a4eed4c6817971b16bd9e44ea877da07dfac3c82eb765c04fe3c298c44"
      ],
      "horizon_hours": [
        24,
        48
      ],
      "status": "CANDIDATE"
    }
  ],
  "unresolved_remainder": [
    "UNCALIBRATED_FORECAST",
    "REVIEW_LATENCY_IS_CAPACITY_PROXY",
    "PENDING_REVIEWS_ARE_CENSORED",
    "NO_TASK_SIZE_OR_COMPLEXITY_SIGNAL",
    "CALENDAR_FREE_TIME_IS_NOT_REVIEW_COMMITMENT",
    "PRESSURE_DIFFERENTIAL_ONTOLOGY_OPEN"
  ],
  "evaluation": {
    "evaluator_id": "cognitive-meteorology.f0.1",
    "evaluator_version": "0.1.0",
    "matched_rules": [
      "f0.1:cold_front",
      "f0.1:high_pressure",
      "f0.1:pressure_differential"
    ],
    "pressure_differential": 0.875,
    "pressure_differential_role": "EXPERIMENTAL_RELATIONAL_FEATURE"
  }
}
